{
 "id": "ev-11bd67b498-U_200890",
 "type": "info",
 "impact": "medium",
 "topics": [
  "отрасль",
  "спрос",
  "курс"
 ],
 "is_new": true,
 "published": "2026-10-20",
 "title": "Дефицит меди к 2050 году: $332 млрд инвестиций — сигнал для металлотрейдеров",
 "takeaway": {
  "cfo": "Дефицит меди — аргумент запасов и пересмотра закупочных цен; проверьте долю меди в обороте.",
  "ceo": "Долгосрочный дефицит меди поддерживает спрос на металлы — шанс расширить ассортимент и клиентов.",
  "treasurer": "Ставка, вероятно, останется 14% до апреля 2027 (прогноз Орловой) — закладывайте дорогие рубли в ВЭД-расчёты."
 },
 "key_points": [
  {
   "t": "Медным рудникам потребуется около $332 млрд новых инвестиций, чтобы предотвратить дефицит предложения меди в будущем.",
   "p": "fact",
   "src": 0
  },
  {
   "t": "К 2050 году на рынке меди прогнозируется дефицит в 20 млн метрических тонн; без допинвестиций предложение может сократиться на 14,5% до 25,7 млн тонн против 30 млн тонн в 2026 году.",
   "p": "fact",
   "src": 0
  },
  {
   "t": "Для компании это долгосрочный сигнал роста цен на металл — но доля меди в её обороте по данным банка не видна, поэтому эффект оценён качественно.",
   "p": "ai"
  }
 ],
 "why_short": "Компания — оптовый трейдер металлов, и прогноз дефицита меди напрямую влияет на её закупочные цены и спрос клиентов.",
 "matched": [
  "отрасль: Добыча металлических руд (07)",
  "отрасль: Металлургия (24)"
 ],
 "sources": [
  {
   "name": "MarketTwits",
   "kind": "news",
   "date": "2026-10-20",
   "url": "https://t.me/markettwits/389628"
  },
  {
   "name": "Альфа-Банк: «Российская сталь: ралли цен продолжается; прогноз результатов за 1К21», стр. 1",
   "kind": "bank",
   "date": "2021-04-15",
   "url": "https://drive.google.com/file/d/1yLCBrIoyIsubLTEBvBHh6io48ysnW-wn/view"
  }
 ],
 "blocks": {
  "what": [
   {
    "t": "Bloomberg New Energy Finance оценивает потребность медных рудников в ~$332 млрд новых инвестиций для предотвращения дефицита предложения.",
    "p": "fact",
    "src": 0
   },
   {
    "t": "К 2050 году прогнозируется дефицит меди в 20 млн метрических тонн.",
    "p": "fact",
    "src": 0
   },
   {
    "t": "Без дополнительных инвестиций предложение меди может сократиться на 14,5% — до 25,7 млн тонн к 2050 году против 30 млн тонн в 2026 году.",
    "p": "fact",
    "src": 0
   }
  ],
  "why": [
   {
    "t": "Компания торгует металлами и металлическими рудами оптом (ОКВЭД 46.72), поэтому долгосрочный дефицит меди — прямой фактор её закупочных цен и маржи.",
    "p": "ai"
   },
   {
    "t": "Отбор сработал по отраслевым меткам «Добыча металлических руд» и «Металлургия» — смежные сегменты цепочки поставок компании.",
    "p": "ai"
   },
   {
    "t": "Клиенты компании — производители резиновых и пластмассовых изделий (12% входящего потока), оптовая торговля (5%) и строительные работы (3%); рост цен на металлы может переноситься в их издержки и спрос.",
    "p": "ai"
   },
   {
    "t": "Отрасль известна лишь для 21% входящего потока клиентов, поэтому оценка влияния через клиентскую базу неполная.",
    "p": "ai"
   }
  ],
  "risks": [
   {
    "t": "Если дефицит меди реализуется, закупочные цены на металл будут расти — при транзитной/агентской модели (выручка 59,6 млрд ₽ при штате менее 15 человек) маржа чувствительна к волатильности цен.",
    "p": "ai",
    "strength": "medium"
   },
   {
    "t": "Нет данных о доле меди в обороте компании — масштаб эффекта не подтверждён.",
    "p": "ai",
    "strength": "medium"
   }
  ],
  "opportunities": [
   {
    "t": "Долгосрочный дефицит меди поддерживает спрос и цены на металлы — шанс расширить ассортимент и нарастить оборот.",
    "p": "ai",
    "strength": "medium"
   },
   {
    "t": "Клиенты в строительстве и производстве могут наращивать закупки впрок, если ожидают роста цен на металл.",
    "p": "ai",
    "strength": "low"
   }
  ],
  "actions": [
   {
    "t": "Оценить фактическую долю меди и цветных металлов в закупках и обороте; при значимой доле — пересмотреть ценовую политику и условия контрактов (индексация цен).",
    "p": "ai"
   },
   {
    "t": "Проверить валютную структуру расчётов по ВЭД и при необходимости обсудить с банком инструменты хеджирования курсового риска.",
    "p": "ai",
    "cta": {
     "label": "Обсудить с менеджером",
     "kind": "manager"
    }
   }
  ],
  "bank": {
   "quote": "",
   "doc": "Свежей оценки банка нет. Последняя — «Российская сталь: ралли цен продолжается; прогноз результатов за 1К21» от 2021-04-15: старше 12 месяцев, в выводе не используется",
   "date": "2021-04-15",
   "stale": true
  },
  "basis": {
   "features": [
    "отрасль: Добыча металлических руд (07)",
    "отрасль: Металлургия (24)",
    "Продукты банка: РКО"
   ],
   "coverage": "Последняя отраслевая оценка банка — «Российская сталь: ралли цен продолжается; прогноз результатов за 1К21» (2021-04-15): старше 12 месяцев, в выводе не используется. Текст новости — только анонс источника, полный текст недоступен. Выручка 59,6 млрд ₽ при штате менее 15 человек — нетипично, возможна агентская или транзитная модель; Нет данных о поставщиках в платёжной выборке; Отрасль известна лишь для 21% входящего потока"
  }
 },
 "trace": [
  {
   "kind": "plan",
   "title": "План",
   "detail": "Проверить аналитику банка по отрасли металлов и меди; Найти связанные новости по рынку меди; Оценить влияние дефицита на бизнес компании (цены/маржа/риски); Сформулировать вывод для руководителя",
   "ms": 5177,
   "cost": 0.0119
  },
  {
   "kind": "tool",
   "title": "search_bank_analytics(query=\"прогноз цен на медь дефицит предложения\", industry=\"46.72\", max_age_days=365)",
   "ms": 0,
   "cost": 0,
   "detail": "Событие касается долгосрочного дефицита меди на мировом рынке. Компания занимается оптовой торговлей металлами (ОКВЭД 46.72) с выручкой 59,6 млрд ₽. Необходимо понять, как прогноз дефицита и потребнос · результат: 4 объект(ов)"
  },
  {
   "kind": "tool",
   "title": "search_news(query=\"цены на медь прогноз дефицит предложения 2026\", days=30)",
   "ms": 6548,
   "cost": 0.0816,
   "detail": "Отраслевая оценка банка по металлам устарела (2021 год), поэтому использовать её нельзя. Макроаналитика (S2, S3) указывает на инфляционное давление и способность предприятий переносить рост издержек в · результат: 4 объект(ов)"
  },
  {
   "kind": "tool",
   "title": "calculate_impact()",
   "ms": 2,
   "cost": 0,
   "detail": "числового шока в новости нет — расчёта нет"
  },
  {
   "kind": "draft",
   "title": "Черновик карточки",
   "detail": "14 утверждений, источников в работе: 9",
   "ms": 42938,
   "cost": 0.3657
  },
  {
   "kind": "check",
   "title": "Самопроверка (код)",
   "detail": "Все проверки пройдены Исправлено до проверки: убрано: «Дорогие деньги: банк ждёт ставку 14% до апреля 202…»; убрано: «Альфа-Банк (Н. Орлова): ЦБ сохранит ставку 14% и, …».",
   "ms": 0,
   "cost": 0
  },
  {
   "kind": "check",
   "title": "Самопроверка (модель)",
   "detail": "key_points[0] и blocks.what[0] ссылаются на src 0, но источник [S1] (MarketTwits) содержит эту информацию — фактически подтверждается; однако в sources[0] указан MarketTwits, а sources[1] дублирует текст новости как отдельный источник с тем же URL — дублирование источников искажает нумерацию src.; key_points[1] ссылается на src 1, но источник [S2] — это банковский отчёт «Бонд Бриф» от 2026-09-14, не содержащий данных о дефиците меди к 2050 году; факт не подтверждается указанным источником.; blocks.what[2] ссылается на src 0, но данные о сокращении предложения на 14,5% до 25,7 млн тонн содержатся в [S1], а не в источнике с индексом 0 в исходном списке — путаница в нумерации.",
   "ms": 7362,
   "cost": 0.2399
  },
  {
   "kind": "research",
   "title": "search_bank_analytics(\"доля меди и медных руд в обороте компании ОКВЭД 46.72; контрагенты из добычи металлических руд (07) и металлургии (24); ВЭД Ирак Ливан Грузия; прогноз ключевой ставки ЦБ до апреля 2027\")",
   "detail": "повторный поиск по замечанию проверки: 4 фрагм.",
   "ms": 1,
   "cost": 0
  },
  {
   "kind": "draft",
   "title": "Правка черновика",
   "detail": "14 утверждений, источников в работе: 13",
   "ms": 12189,
   "cost": 0.1635
  },
  {
   "kind": "check",
   "title": "Самопроверка (код)",
   "detail": "Все проверки пройдены Исправлено до проверки: убрано: «Проинфляционные риски и жёсткая ДКП (ЦБ, вероятно,…».",
   "ms": 0,
   "cost": 0
  },
  {
   "kind": "done",
   "title": "Карточка готова",
   "detail": "Все проверки пройдены",
   "ms": 0,
   "cost": 0
  }
 ],
 "chat": []
}